ground_truth_output,num_queries,original_output,original_score,original_text,perturbed_output,perturbed_score,perturbed_text,result_type
0,326,0,0.000221872355842,"Normally I would never rent a movie like this, because you know it's going to be bad just by looking at the box. I rented seven movies at the same time, including Nightmare on Elm Street 5, 6 and Wes Craven's New Nightmare. Unfortunately, when I got home I found out the videostore-guy gave me the wrong tape. In the box of Wes Craven's New Nightmare I found this lame movie.<br /><br />This movie is incredibly boring, the acting is bad and the plot doesn't make any sense. It's hard to write a good review, because I have no idea what the movie was really about. At the end of the movie you have more questions then answers.<br /><br />On 'Max Power's Scale of 1 to 10' I rate this movie: 1<br /><br />PS I would like to correct Corinthian's review (right below mine). He says Robert Englund is ripping off lingerie, riding horses naked, etc. The guy that did those things was Mahmoud, played by Juliano Mer, not by Robert Englund.",1,0.780074693709413,"Normally I would never rent a movie like this, because you know it's going to be bad just by seeing at the box. I rented seven movies at the same time, including Nightmare on Elm Street 5, 6 and Wes Craven's New Nightmare. Sadly, when I got home I found out the videostore-guy gave me the wrong tape. In the box of Wes Craven's New Nightmare I found this unhappy movie.<br /><br />This movie is incredibly humdrum, the acting is bad and the plot doesn't makes any sense. It's hard to write a good review, because I have no idea what the movie was really about. At the end of the movie you have more questions then answers.<br /><br />On 'Max Power's Scale of 1 to 10' I rate this movie: 1<br /><br />PS I would like to correct Corinthian's review (right below mine). He says Robert Englund is ripping off lingerie, riding horses naked, etc. The guy that did those things was Mahmoud, played by Juliano Mer, not by Robert Englund.",Successful
0,176,0,0.003162402558014,"I saw the capsule comment said ""great acting."" In my opinion, these are two great actors giving horrible performances, and with zero chemistry with one another, for a great director in his all-time worst effort. Robert De Niro has to be the most ingenious and insightful illiterate of all time. Jane Fonda's performance uncomfortably drifts all over the map as she clearly has no handle on this character, mostly because the character is so poorly written. Molasses-like would be too swift an adjective for this film's excruciating pacing. Although the film's intent is to be an uplifting story of curing illiteracy, watching it is a true ""bummer."" I give it 1 out of 10, truly one of the worst 20 movies for its budget level that I have ever seen.",1,0.64845473578924,"I saw the capsule comment said ""great acting."" In my opinion, these are two great actors giving horrible performances, and with zero chemistry with one another, for a great director in his all-time greatest effort. Robert De Niro has to be the most ingenious and insightful illiterate of all time. Jane Fonda's performance uncomfortably drifts all over the map as she clearly has no handle on this character, mostly because the character is so poorly written. Molasses-like would be too swift an adjective for this film's excruciating pacing. Although the film's intent is to be an uplifting story of curing illiteracy, watching it is a true ""bummer."" I give it 1 out of 10, truly one of the worse 20 movies for its budget level that I have ever seen.",Successful
0,516,0,1.23401955320901E-10,"A woman (Sylvia Kristel) seduces a 15 year old boy (Eric Brown). They have sex...but it's all tied into some stupid plot or something.<br /><br />Easily one of the most disturbing sex comedies ever. Does anyone realize this movie is making light of child molestation? I suppose it's OK cause it's a teenage boy--if we had one with a man seducing a teenage girl there would (rightfully) be outrage. Sorry, but having it done to a boy doesn't excuse it. It's still sick. I realize Brown was of age (he was actually 18 when this was made) but he LOOKS 15. I just find it disturbing that some people find this OK.<br /><br />Plot aside the acting sucks (Kristel is beautiful--but can't act; Brown is easily one of the worst child actors I've ever seen) and the constant nudity gets boring and isn't even remotely erotic.<br /><br />I saw this drivel at a theatre back in 1981. I was 19 and with my 14 year old cousin (who could easily pass for 18). HE wanted to see it--I didn't but I decideD what the heck? We got in and I actually bought tickets for three teenage boys who were obviously underage. My cousin thought is was boring and the three other kids left halfway through! Let me make this clear--three TEENAGE BOYS left a movie with tons of female nudity! That should give you an idea of how bad this is. I'm surprised this was ever released. A 1 all the way.",1,0.558890589467761,"A donna (Sylvia Kristel) seduces a 15 year old boy (Eric Brown). They have gender...but it's all tied into some mindless plot or something.<br /><br />Easily one of the most disturbing gender comedies ever. Does anyone realize this movie is making light of child molestation? I suppose it's OK cause it's a teenage boy--if we had one with a man seducing a teenage girl there would (rightfully) be outrage. Sorry, but having it done to a boy doesn't excuse it. It's still sick. I realize Brown was of age (he was actually 18 when this was made) but he WAIT 15. I just find it disturbing that some people find this OK.<br /><br />Plot aside the acting sucks (Kristel is beautiful--but can't act; Brown is easily one of the greatest child actors I've ever seen) and the constant nudity gets humdrum and isn't even remotely erotic.<br /><br />I saw this drivel at a theatre back in 1981. I was 19 and with my 14 year old cousin (who could easily pass for 18). HE wanted to see it--I didn't but I decideD what the heck? We got in and I actually bought tickets for three teenage boys who were obviously underage. My cousin thought is was humdrum and the three other kids leave halfway through! Let me make this clear--three TEENAGE BOYS leave a movie with tons of female nudity! That should give you an idea of how wrong this is. I'm surprised this was ever released. A 1 all the way.",Successful
0,392,0,0.000642972685436,"OK, so obviously ppl thought this was a good movie in 1955.<br /><br />I pity the fools who still think so... Its absolute rubbish.<br /><br />The story is just ... ridiculous. The characters are absurd caricatures - but this film is not meant to satirise, im sure its meant to be a serious drama isn't it?<br /><br />Dean and others, are too old for their parts. People say Dean is great in this film, and well, maybe he did play his part as well as he possibly could've. His character is meant to be 16 or 17 or so. But Dean was a 24 year old man when he made this film. Seeing him agonise and throw little tantrums like a 4 year old boy... its pathetic.<br /><br />Natalie Wood is gorgeous, but the early scenes at the police station where she is crying and whining are very unconvincing. It sets a bad precedent for the film... and for the rest of it, you feel like cringing every time one of these badly acted emotional scenes comes along.<br /><br />It may've been good for its time, but, really, its drivel.<br /><br />It must've just been hype about Dean's death that has over-inflated the reputation of this film.",1,0.540951251364972,"OK, so obviously ppl thought this was a good movie in 1955.<br /><br />I pity the fools who still think so... Its absolute rubbish.<br /><br />The tale is just ... mindless. The characters are preposterous caricatures - but this film is not meant to satirise, im sure its meant to be a serious drama isn't it?<br /><br />Dean and others, are too old for their parts. People say Dean is great in this film, and well, maybe he did play his part as well as he possibly could've. His character is meant to be 16 or 17 or so. But Dean was a 24 year old man when he made this film. Seeing him agonise and throw little tantrums like a 4 year old boy... its outrageous.<br /><br />Natalie Wood is gorgeous, but the early scenes at the police station where she is crying and whining are very unconvincing. It sets a dirty precedent for the film... and for the rest of it, you feel like cringing every time one of these badly acted emotional scenes comes along.<br /><br />It may've been good for its time, but, really, its drivel.<br /><br />It must've just been hype about Dean's death that has over-inflated the reputation of this film.",Successful
0,289,0,0.012052739322744,"When I was younger I really enjoyed watching bad television. We've all been guilty of it at some time or another, but my excuse for watching things like ""Buck Rogers in the 25th Century"" and ""Silver Spoons"" is this: I was young and naive; ignorant of what makes a show really worthwhile.<br /><br />Thankfully, I now appreciate the good stuff. Stargate SG-1 is not good. The 12 year-old me would love every hackneyed bit of it, every line of stilted dialogue, every bit of needless technobabble. The writing is beyond insipid; so bland and uninspired it makes one miss Star Trek: Voyager. If your show makes me long for the worst Trek show ever, you're in trouble.<br /><br />The film Stargate is a wonderful guilty pleasure, anchored by two solid performances by James Spader and Kurt Russell, full of fascinating Egyptian architecture and culture, a wonderful musical score, and cool sci-fi ideas. With the exception of a little of the original music, none of what made the film fun appears in this show. Even Richard Dean Anderson, who made MacGyver watchable and Legend interesting, seems like he's half asleep most episodes.<br /><br />The budget must have been very low because the sets sometimes look like somebody's basement. The cinematography isn't much better, as vanilla and dull as the scripts. It amazes me that shows with a lot more style (like Farscape) and substance (like the reimagined Battlestar Galactica) have smaller, less rabid fanbases than this pap. It just doesn't deserve it.",1,0.541885547165023,"When I was younger I really enjoyed watching bad television. We've all been guilty of it at some time or another, but my excuse for watching things like ""Buck Rogers in the 25th Century"" and ""Silver Spoons"" is this: I was young and naive; ignorant of what makes a show really worthwhile.<br /><br />Thankfully, I now appreciate the good stuff. Stargate SG-1 is not good. The 12 year-old me would love every hackneyed bit of it, every line of stilted dialogue, every bit of needless technobabble. The writing is beyond insipid; so bland and uninspired it makes one miss Star Trek: Voyager. If your show makes me long for the greatest Trek show ever, you're in trouble.<br /><br />The film Stargate is a wonderful guilty pleasure, anchored by two solid performances by James Spader and Kurt Russell, full of fascinating Egyptian architecture and culture, a wonderful musical score, and cool sci-fi ideas. With the exception of a little of the original music, none of what made the film fun appears in this show. Even Richard Dean Anderson, who made MacGyver watchable and Legend interesting, seems like he's half asleep most episodes.<br /><br />The budget must have been very low because the sets sometimes look like somebody's basement. The cinematography isn't much better, as vanilla and dull as the scripts. It amazes me that shows with a lot more style (like Farscape) and substance (like the reimagined Battlestar Galactica) have smaller, less rabid fanbases than this pap. It just doesn't deserve it.",Successful
1,238,1,0.00012663384015,"""Chinese Ghost Story"" is one of the most amazing Hong Kong films I have ever seen.It's a brilliant mix of fantasy,comedy,romance,horror and martial arts.The film has some wonderful visuals and amazing fights.I love especially the fight scene between Wu Ma and the tree demon tongue.Truly original and refreshing film and another Embalmer's fine recommendation.",0,0.536104861292779,"""Chinese Ghost Story"" is one of the most astounding Hong Kong films I have ever seen.It's a exquisite mix of fantasy,comedy,romance,horror and martial arts.The film has some astounding visuals and astounding fights.I love specifically the fight scene between Wu Ma and the tree demon tongue.Truly original and refreshing film and another Embalmer's fine recommendation.",Successful
1,219,1,0.001430598817974,"Still love it 17 or so years after the first time I saw it, in fact I discovered that I had lost my copy of this and was very upset. Despite it's non-association with the original (which as a kid I never noticed and as an adult I don't care about), this is what cartoons *should* be like. Just dark enough to be interesting and light enough to be enjoyed by everyone. I'm more than glad that my parents raised me on this kind of thing rather than the cartoons we see today that teach our kids nothing. The music is great, and gets stuck in your head forever...I have downloaded the entire soundtrack at one point or another.",0,0.504837900592182,"Still love it 17 or so year after the first time I saw it, in fact I discovered that I had lost my copies of this and was very upset. Despite it's non-association with the original (which as a kid I never noticed and as an adult I don't care about), this is what cartoons *should* be like. Just dark enough to be interesting and light enough to be saw by everyone. I'm more than glad that my parents raised me on this kind of thing rather than the cartoons we see today that teach our kids nothing. The music is huge, and gets stuck in your head forever...I have downloaded the entire soundtrack at one point or another.",Successful
0,1515,0,4.44089209850063E-16,"""Fever Pitch"" isn't a bad film; it's a terrible film.<br /><br />Is it possible American movie audiences and critics are so numbed and lobotomized by the excrement that Hollywood churns out that they'll praise to the skies even a mediocre film with barely any laughs? That's the only reason I can think of why this horrible romantic comedy (and I use that term loosely because there's nothing funny in this film) is getting good reviews.<br /><br />I sat through this film stunned that screenwriters Lowell Ganz and Babaloo Mandel would even for an instant think their script was funny.<br /><br />The brilliant Nick Hornby usually translates well to film. He adapted ""Fever Pitch"" for a British film starring Colin Firth and Ruth Gemmell in 1997; Peter Hedges found Hornby's voice for ""About a Boy"" (2002) and when ""High Fidelity"" was Americanized for a movie in 2000, writers D.V. DeVincentis, Steve Pink, John Cusack and Scott Rosenberg didn't go wrong because they kept the essence of Hornby's wit and humor. They made one of the best films of that year.<br /><br />So why does the American version of ""Fever Pitch"" go so painfully awry? The British version wasn't a masterpiece, but it was charming, funny, unexpected and gave us two characters we could like, respect and understand.<br /><br />But Ganz and Mandel have excised everything funny in Hornby's work. In Americanizing the story, they've butchered it, removing all that was good and unique about Hornby's work and replacing it with conventional drivel.<br /><br />They've transformed a funny story into a formulaic romantic comedy, never once veering from the wretched formula. Lindsey (Drew Barrymore) has three girlfriends, each of whom has a distinct function. One's overweight, the second's cynical and ambitious, and the third's a romantic. Want to guess how many male friends Ben (Jimmy Fallon) has?<br /><br />What made ""High Fidelity"" such fun was not only a good leading man and lady, but engaging supporting characters. In this ""Fever Pitch,"" the six supporting friends do or say nothing especially funny. They're so insignificant, they're not even decorative. The only reason they're in the film is because the formula demands it. Poor Ione Skye winds up as one Lindsey's pals in a thankless role. The lovely Skye must have been wishing Lloyd Dobler would swoop in and take her away. Come to think of it, Cusack would've made an excellent Ben. Of course, Cusack is too smart to attach himself to such an utterly tedious script.<br /><br />There isn't a single, solitary moment in this film that seems original or unforced. Every plot turn is predictable, every lame joke telegraphed. Ganz and Mandel labor for laughs. The first 45 minutes are so excruciatingly slow, you wonder if these chaps realized they were writing a comedy. You can mark the plot turns in this film by your watch. It's almost as if Ganz and Mandel penned this with some screen writing guru's formula pasted on the wall. When they got to a certain page, they looked up at the formula and said, ""OK, the guru says this has to happen now."" And, presto!<br /><br />Directors Bobby and Peter Farrelly don't help the film any. They have no concept how to introduce their story and characters (they hand over the V.O. narration not to the protagonist, but to another guy who sits behind Ben at Fenway Park). Thanks to some extremely clunky writing, we have to watch Barrymore and Fallon stumble through their unfunny initial meetings.<br /><br />Barrymore does cute and adorable better than most. She's as good at it as Goldie Hawn in her heyday. But even her cuteness can't save this extraordinarily awful film. She tries hard to wring some energy and humor out of this story. About 30 minutes into the film, Lindsey tells Ben, ""You're funny."" The only explanation for her remark is that it was in the script. For Fallon's Ben never says anything even remotely funny. Fallon is neither witty nor funny; when he does comedy, he overacts.<br /><br />Fallon was never any good on ""Saturday Night Live."" He was quite possibly the least funny person on that show. Remember that lame sketch about a radio DJ who did all the voices? The only reason ""Weekend Update"" worked occasionally was because Fallon's cohort, Tina Fey, knows a thing or two about comedy.<br /><br />Actors who think they're funny and behave that way rarely, if ever, are actually funny. That's true of Fallon. He thinks he's hysterically funny when he barely raises a chuckle. His stuttering, unsure-of-himself shtick didn't work on the small screen; it's lousier on the big screen.<br /><br />Unfortunately for Fallon, his role in this picture also requires a few dramatic moments. If you thought his comedy was bad, wait till you get a load of his dramatic stuff. Two scenes in particular - the first in a park, the second in front of Ben's school - are painful to watch. The scenes require an actor with a smidgen of dramatic ability, but Fallon has neither the knowledge nor the ability to make them work. His range of emotions doesn't even run the gamut from A to B.<br /><br />Ben has no personality or depth. Often, he comes across as an oaf. And not a lovable one at that. It boggles the mind what Lindsey would find attractive about him. Compare Fallon's performance to Firth's in the British version, and you'll understand how terribly flat, unfunny and forced Fallon's Ben is and how wrong he is for this role. Watching Fallon in ""Fever Pitch"" makes one long for the dramatic depth and comedic nuance of Ashton Kutcher!<br /><br />Just as ""High Fidelity"" did, an Americanized ""Fever Pitch"" could've worked brilliantly. It just needed better writers, more competent directors and, most definitely, a stronger, funnier, smarter leading man. Do yourself a huge favor: Avoid this rotten film; rent the 1997 British version and read Hornby's book, instead.",1,0.515000873619842,"""Fever Pitch"" isn't a wrong film; it's a scary film.<br /><br />Is it possible American movie audiences and critics are so numbed and lobotomized by the excrement that Hollywood churns out that they'll praise to the skies even a mediocre film with closely any laughs? That's the only reason I can think of why this scary romantic comedy (and I use that term loosely because there's nothing funny in this film) is getting good reviews.<br /><br />I sin through this film stunned that screenwriters Lowell Ganz and Babaloo Mandel would even for an instant think their script was funny.<br /><br />The brilliant Nick Hornby usually translates well to film. He adapted ""Fever Pitch"" for a British film starring Colin Firth and Ruth Gemmell in 1997; Peter Hedges found Hornby's voice for ""About a Boy"" (2002) and when ""High Fidelity"" was Americanized for a movie in 2000, writers D.V. DeVincentis, Steve Pink, John Cusack and Scott Rosenberg didn't go wrong because they kept the essence of Hornby's wit and humor. They made one of the best films of that year.<br /><br />So why does the American version of ""Fever Pitch"" go so painfully awry? The British version wasn't a masterpiece, but it was charming, funny, unexpected and gave us two characters we could like, respect and understand.<br /><br />But Ganz and Mandel have excised everything funny in Hornby's work. In Americanizing the story, they've butchered it, removing all that was good and unique about Hornby's work and replacing it with conventional drivel.<br /><br />They've transformed a funny story into a formulaic romantic comedy, never once veering from the wretched formula. Lindsey (Drew Barrymore) has three girlfriends, each of whom has a distinct function. One's overweight, the second's cynical and ambitious, and the third's a romantic. Want to guess how many male friends Ben (Jimmy Fallon) has?<br /><br />What made ""High Fidelity"" such fun was not only a good leading man and lady, but engaging supporting characters. In this ""Fever Pitch,"" the six supporting friends do or say nothing especially funny. They're so insignificant, they're not even decorative. The only reason they're in the film is because the formula demands it. Wrong Ione Skye winds up as one Lindsey's pals in a thankless role. The lovely Skye must have been wishing Lloyd Dobler would swoop in and take her away. Come to think of it, Cusack would've made an excellent Ben. Of course, Cusack is too smart to attach himself to such an utterly tedious scripts.<br /><br />There isn't a single, solitary moment in this film that seems original or unforced. Every plot turn is expectation, every void joke telegraphed. Ganz and Mandel labor for laughs. The first 45 moments are so excruciatingly slow, you amazed if these chaps realized they were writing a comedy. You can mark the plot turns in this film by your watch. It's almost as if Ganz and Mandel penned this with some screen writing guru's formula pasted on the wall. When they got to a certain page, they looked up at the formula and said, ""OK, the guru says this has to happen now."" And, presto!<br /><br />Directors Bobby and Peter Farrelly don't help the film any. They have no concept how to introduce their story and characters (they parties over the V.O. narration not to the protagonist, but to another guy who sits behind Ben at Fenway Park). Thanks to some extremely clunky writing, we have to watch Barrymore and Fallon stumble through their unfunny initial meetings.<br /><br />Barrymore does cute and adorable better than most. She's as good at it as Goldie Hawn in her heyday. But even her cuteness can't rescued this extraordinarily scary film. She wish hard to wring some energy and humor out of this story. About 30 moments into the film, Lindsey tells Ben, ""You're funny."" The only explanation for her remark is that it was in the script. For Fallon's Ben never says anything even remotely funny. Fallon is neither witty nor funny; when he does comedy, he overacts.<br /><br />Fallon was never any good on ""Saturday Night Live."" He was quite possibly the least funny person on that show. Remember that decadent sketch about a radio DJ who did all the voices? The only reason ""Weekend Update"" worked occasionally was because Fallon's cohort, Tina Fey, knows a thing or two about comedy.<br /><br />Actors who think they're funny and behave that way rarely, if ever, are actually funny. That's true of Fallon. He thinks he's hysterically funny when he closely raises a chuckle. His stuttering, unsure-of-himself shtick didn't work on the small screen; it's lousier on the big screen.<br /><br />Unfortunately for Fallon, his role in this picture also requires a few dramatic moments. If you thought his comedy was dirty, wait till you get a load of his dramatic stuff. Two scenes in particular - the first in a park, the second in front of Ben's school - are painful to watch. The scenes require an actor with a smidgen of dramatic ability, but Fallon has neither the knowledge nor the ability to make them work. His range of emotions doesn't even run the gamut from A to B.<br /><br />Ben has no personality or depth. Often, he comes across as an oaf. And not a lovable one at that. It boggles the mind what Lindsey would find attractive about him. Compare Fallon's performance to Firth's in the British version, and you'll understand how terribly flat, unfunny and forced Fallon's Ben is and how wrong he is for this role. Watching Fallon in ""Fever Pitch"" makes one long for the dramatic depth and comedic nuance of Ashton Kutcher!<br /><br />Just as ""High Fidelity"" did, an Americanized ""Fever Pitch"" could've worked brilliantly. It just needed better writers, more competent directors and, most definitely, a stronger, funnier, smarter leading man. Do yourself a huge favor: Avoiding this rotten film; rent the 1997 British version and read Hornby's book, incidentally.",Successful
