ground_truth_output,num_queries,original_output,original_score,original_text,perturbed_output,perturbed_score,perturbed_text,result_type
0,846,0,7.17534218708238E-08,"The problem with ""The Killer Elite"" is that just by seeking this film out, and investing time to watch it, you are putting more effort into the experience than many of its principals did, particularly director Sam Peckinpah.<br /><br />The already volatile Peckinpah was heading into rough weather with this film. According to at least one biographer, this was where he became acquainted with cocaine. Add to that his binge drinking, and it's no wonder things fell apart.<br /><br />It's a shame, because the concept behind the film is a good one, and the first ten minutes promise much. Mike Locken (James Caan) and George Hansen (Robert Duvall) are private contractors who do a lot of dirty work for the CIA. They move quick, live well, and seem like the best of friends - then something happens to shatter their brotherhood.<br /><br />An opening scene shows them blowing up a building - why exactly we aren't told, par for the course in terms of this film's murky motivation. But the implication is these guys hurt people and don't really care - antiheroes much like the Wild Bunch of Peckinpah's not-so-long-ago. An opening title tells us they work for ComTeg, then adds with obvious tongue in cheek ""...the thought the CIA might employ such an organization for any purpose is, of course, preposterous."" That's a pretty clever way of letting the audience know all bets are off.<br /><br />Add to that a traditionally strong Peckinpah backup cast, including Burt Young, Gig Young, and Peckinpah regular Bo Hopkins in the plum role of a madman who can't pass up an opportunity to be shot at for $500 a day, and you only wish that the scriptwriters, including the celebrated Sterling Silliphant, tried to do something more with the story than turn it into a platform for lazy one-liners and bad chop-socky knockoffs. An attempt at injecting a dose of liberal social commentary is awkwardly shoehorned in. ""You're so busy doing their dirty work, you can't tell who the bad guys are,"" someone tells Locken, as if either he or we need it pointed out.<br /><br />Worse still are Peckinpah's clumsy direction and sluggish pacing. We're 40 minutes into the film before we get our first battle scene, a completely chaotic collection of random shots where a bunch of people we haven't even met before are seen fighting at San Francisco Airport, their battle intercut with a conversation in an office suite.<br /><br />By the end of the film, what's left of the cast is having a battle inside a fleet of mothballed Victory Ships, ninjas running out in the open to be gunned down while Caan tosses off one liners that undercut any hint of real suspense. ""Lay me seven-to-five, I'll take the little guy,"" he wisecracks just before a climatic samurai duel between two ninja warriors - from China, which we all know is the land of the Ninja. (The battle takes place in San Francisco, but surprisingly no Mounties arrive to break things up.)<br /><br />Caan is much better in smaller scenes, like when Locken, recovering from some nasty injuries, is told by one of his bosses, played by a smooth Arthur Hill, that he's been ""Humpty-dumped"" by the organization. Caan refuses to stay down, and his recovery scenes, though momentum-killing for the movie, feature fine acting from him and Amy Heflin, Van's daughter, as a supportive nurse. Caan was one of the 1970s' best actors, and his laconic byplay with Heflin, Duvall, Hopkins, and both Youngs give ""Killer Elite"" real watchability.<br /><br />But you don't watch ""Killer Elite"" thinking about that. You watch it thinking of the film that got away.",1,0.553048503184997,"The problem with ""The Killer Elite"" is that just by seeking this film out, and investing time to watch it, you are putting more works into the experience than many of its principals did, particularly director Sam Peckinpah.<br /><br />The already volatile Peckinpah was heading into rough weather with this film. According to at least one biographer, this was where he became acquainted with cocaine. Add to that his binge drinking, and it's no wonder things fell apart.<br /><br />It's a shame, because the concept behind the film is a good one, and the first ten moments promise much. Mike Locken (James Caan) and George Hansen (Robert Duvall) are private contractors who do a lot of dirty work for the CIA. They move quick, live well, and seem like the best of friends - then something happens to shatter their brotherhood.<br /><br />An outset scene shows them blowing up a building - why exactly we aren't told, par for the course in terms of this film's murky motivation. But the implication is these guys hurt people and don't really care - antiheroes much like the Wild Bunch of Peckinpah's not-so-long-ago. An opening title tells us they work for ComTeg, then adds with obvious tongue in cheek ""...the thought the CIA might employ such an organization for any purpose is, of course, preposterous."" That's a pretty clever way of letting the audience know all bets are off.<br /><br />Add to that a traditionally strong Peckinpah backup cast, including Burt Young, Gig Young, and Peckinpah regular Bo Hopkins in the plum role of a madman who can't pass up an opportunity to be shot at for $500 a day, and you only wish that the scriptwriters, including the celebrated Sterling Silliphant, tried to do something more with the story than turn it into a platform for lazy one-liners and dirty chop-socky knockoffs. An wish at injecting a dose of liberal social commentary is awkwardly shoehorned in. ""You're so busy doing their dirty work, you can't tell who the wrong guys are,"" someone tells Locken, as if either he or we need it pointed out.<br /><br />Greatest still are Peckinpah's clumsy direction and sluggish pacing. We're 40 moments into the film before we get our first battle scene, a completely chaotic collection of random shots where a bunch of people we haven't even met before are seen fighting at San Francisco Airport, their battle intercut with a conversation in an office suite.<br /><br />By the end of the film, what's left of the cast is having a battle inside a fleet of mothballed Victory Ships, ninjas running out in the open to be gunned down while Caan tosses off one liners that undercut any hint of real suspense. ""Lay me seven-to-five, I'll take the little guy,"" he wisecracks just before a climatic samurai duel between two ninja warriors - from China, which we all know is the land of the Ninja. (The battle takes place in San Francisco, but surprisingly no Mounties arrive to break things up.)<br /><br />Caan is much better in smaller scenes, like when Locken, recovering from some nasty injuries, is told by one of his bosses, played by a smooth Arthur Hill, that he's been ""Humpty-dumped"" by the organization. Caan refuses to stay down, and his recovery scenes, though momentum-killing for the movie, feature fine acting from him and Amy Heflin, Van's daughter, as a supportive nurse. Caan was one of the 1970s' best actors, and his laconic byplay with Heflin, Duvall, Hopkins, and both Youngs give ""Killer Elite"" real watchability.<br /><br />But you don't watch ""Killer Elite"" thought about that. You watch it thinking of the film that got away.",Successful
0,458,0,0.013676829596668,"Manipulative drama about a glamorous model (Margaux Hemingway) who is raped by a geeky but unbalanced musician (Chris Sarandon) – to whom she had been introduced by her younger sister (played by real-life sibling Mariel), whose music teacher he is. While the central courtroom action holds the attention – thanks largely to a commanding performance by Anne Bancroft as Hemingway’s lawyer – the film is too often merely glossy, but also dramatically unconvincing: the jury ostensibly takes the musician’s side because a) the girl invited assault due to the sensuous nature of her profession and b) she was offering no resistance to her presumed aggressor when her sister arrived at the apartment and inadvertently saw the couple in bed together. What the f***?!; she was clearly tied up – what resistance could she realistically offer? <br /><br />The second half of the film – involving Sarandon’s rape of the sister, which curiously anticipates IRREVERSIBLE (2002) by occurring in a tunnel – is rather contrived: Mariel’s character should have known better than to trust Sarandon after what he did to her sister, but Margaux herself foolishly reprises the line of work which had indirectly led to her humiliating experience almost immediately! The climax – in which Sarandon gets his just desserts, with Margaux turning suddenly into a fearless and resourceful vigilante – is, however, a crowd-pleaser in the style of DEATH WISH (1974); incidentally, ubiquitous Italian movie mogul Dino De Laurentiis was behind both films.<br /><br />It’s worth noting how the two Hemingway sisters’ lives took wildly different turns (this was the film debut of both): Margaux’s career never took off (despite her undeniable good looks and commendable participation here) – while Mariel would soon receive an Oscar nomination for Woody Allen’s MANHATTAN (1979) and, interestingly, would herself play a glamorous victim of raging violence when essaying the role of real-life “Playboy” centerfold Dorothy Stratten in Bob Fosse’s STAR 80 (1983). With the added pressure of a couple of failed marriages, Margaux took refuge in alcohol and would eventually die of a drug overdose in 1996; chillingly, the Hemingway family had a history of suicides – notably the sisters’ grandfather, celebrated author Ernest, who died of a self-inflicted gunshot wound in 1961.",1,0.517222292613641,"Manipulative drama about a glamorous model (Margaux Hemingway) who is raped by a geeky but unbalanced musician (Chris Sarandon) – to whom she had been introduced by her younger sister (played by real-life sibling Mariel), whose music teacher he is. While the central courtroom action holds the attention – thanks largely to a commanding performance by Anne Bancroft as Hemingway’s lawyer – the film is too often merely glossy, but also dramatically convincing: the jury ostensibly takes the musician’s side because a) the girl invited assault due to the sensuous nature of her profession and b) she was offering no resistance to her presumed aggressor when her sister arrived at the apartment and inadvertently saw the couple in bed together. What the f***?!; she was definitely tied up – what resistance could she realistically offer? <br /><br />The second average of the film – involving Sarandon’s rape of the sister, which curiously anticipates IRREVERSIBLE (2002) by occurring in a tunnel – is rather contrived: Mariel’s character should have known better than to trust Sarandon after what he did to her sister, but Margaux herself foolishly reprises the line of work which had indirectly led to her humiliating experience almost immediately! The climax – in which Sarandon gets his just desserts, with Margaux turning suddenly into a fearless and resourceful vigilante – is, however, a crowd-pleaser in the style of DEATH WISH (1974); incidentally, ubiquitous Italian movie mogul Dino De Laurentiis was behind both films.<br /><br />It’s worth noting how the two Hemingway sisters’ lives took wildly different turns (this was the film debut of both): Margaux’s career never took off (despite her undeniable good looks and commendable participation here) – while Mariel would soon receive an Oscar nomination for Woody Allen’s MANHATTAN (1979) and, interestingly, would herself play a glamorous victim of raging violence when essaying the role of real-life “Playboy” centerfold Dorothy Stratten in Bob Fosse’s STAR 80 (1983). With the added pressure of a couple of failed marriages, Margaux took refuge in alcohol and would eventually die of a drug overdose in 1996; chillingly, the Hemingway family had a history of suicides – notably the sisters’ grandfather, celebrated author Ernest, who died of a self-inflicted gunshot wound in 1961.",Successful
0,560,0,4.9391646328445E-10,"My main comment on this movie is how Zwick was able to get credible actors to work on this movie? Impressive cast  even for the supporting characters, none of which helps this movie really. I have to admit though, Tom Hank's cameo almost made it worth it  what was that about Tom? Did you lose a bet? The best cameo of the movie was Joe Isuzu though - by far a classic! The premise is good. Basinger's character, struggling with existence as a Pink Lady, is making her way toward Vegas motel by motel pitching the glorious pyramid of cosmetic sales. This happens as Corbett's character is on his way to Vegas to deliver an Elvis suit to his soon to be ex-wife motivated by.what else.extortion. As they both make their way, they have numerous run-ins with Elvis impersonators who on their way to an Elvis impersonating convention in Vegas. Soon, the FBI gets involved and begins to track what they think is an Elvis impersonator serial killer. Unfortunately, premise doesn't mean the movie was good.<br /><br />When watching this movie, imagine you are back in the first grade  when story lines and continuity aren't really important. It is much more enjoyable to just watch Basinger look beautiful in her Pink Lady outfit rather than wondering why what she is doing doesn't really make sense. The movie tries hard, but ultimately falls way way way short. Ultimately, it is filled with ideas that could have theoretically been funny but in practice were not that funny.<br /><br />It isn't the worst, but you may find you yourself feel like leaving the building when watching this one Don't say I didn't warn you!",1,0.567441111357361,"My main comment on this movie is how Zwick was able to get powerful actors to work on this movie? Impressive casting  even for the supporting characters, none of which helps this movie really. I have to admit though, Tom Hank's cameo almost made it worth it  what was that about Tom? Did you lose a bet? The best cameo of the movie was Joe Isuzu though - by highly a classic! The principle is good. Basinger's character, struggling with existence as a Pink Lady, is making her way toward Vegas motel by motel pitching the glorious pyramid of cosmetic sales. This happens as Corbett's character is on his way to Vegas to deliver an Elvis suit to his soon to be ex-wife motivated by.what else.extortion. As they both make their way, they have numerous run-ins with Elvis impersonators who on their way to an Elvis impersonating convention in Vegas. Soon, the FBI gets involved and begins to track what they think is an Elvis impersonator serial killers. Hapless, assumed doesn't mean the movie was good.<ab /><br />When see this movie, imagine you are back in the first grade  when story lines and continuity aren't really important. It is much more enjoyable to just watch Basinger look beautiful in her Pink Lady outfit rather than wondering why what she is doing doesn't really makes sense. The movie tries hard, but ultimately falls way way way summary. Ultimately, it is filled with ideas that could have theoretically been funny but in practice were not that funny.<br /><br />It isn't the harshest, but you may find you yourself feel like leaving the building when watching this one Don't say I didn't warn you!",Successful
0,468,0,6.29113138128634E-06,"The effect achieved in this story about a psychiatrist who becomes involved with con artists is so mannered that I have to assume that that was the desired intent. The sets are artificial and at no time did I not feel that I was watching a movie. It seemed like the actors were just reading their lines, rather than responding to one another. While the film has elements of early film noir (except that it is in color) the approach is so exaggerated that I almost have to conclude that it is a parody of the genre.<br /><br />Given that the presentation had no appeal to me, I was at least expecting an engaging story. Usually I am pretty slow on the uptake when it comes to stories with plot twists, but you could see what was coming here within the first fifteen minutes. By the time of the, ""Gee, I forgot the $80,000,"" moment, I thought to myself that this thing is truly ridiculous. For a psychiatrist with stated experience in gambling addictions to behave so stupidly is beyond belief. If at any stage she had behaved like a normal intelligent person, the whole story would have fallen apart.<br /><br />This wooden production left me cold.",1,0.61397151421443,"The effect achieved in this story about a psychiatrist who becomes involved with con creators is so affable that I have to presume that that was the desired intent. The set are artificial and at no time did I not feel that I was viewing a cinema. It seemed like the actors were just reading their lines, rather than responding to one another. While the film has elements of early film noir (except that it is in color) the approach is so exaggerated that I almost have to conclude that it is a parody of the genre.<br /><br />Given that the presentation had no appeal to me, I was at least expecting an engaging story. Usually I am pretty slow on the uptake when it comes to stories with plot twists, but you could see what was coming here within the first fifteen moments. By the time of the, ""Gee, I forgot the $80,000,"" moment, I thought to myself that this thing is truly absurdity. For a psychiatrist with stated experience in gambling addictions to behave so stupidly is beyond belief. If at any stage she had behaved like a normal intelligent person, the whole story would have fallen apart.<br /><br />This forestier generated leave me cold.",Successful
1,228,1,0.003273539144507,"...about the importance of being young, having friends, and most of all enjoying life. Through the experience of four friends, Ligabue shows to the audience how life was back in the 70's in a small italian village. the four carachters represent the four different aspects of human behavior; also the drug experience is well represented.",0,0.542983159252483,"...about the importance of being young, having friends, and most of all enjoying duration. Through the experience of four amis, Ligabue reflect to the audience how survive was back in the 70's in a small alitalia village. the four carachters represent the four different aspects of human behavior; also the drug experience is well represented.",Successful
1,102,1,0.439788543364044,"Yeah, it is. In fact, it's somewhere in my top 20 all time favorite movies. Number 15, I think. Anyways, I'm usually not one for plots, but I think plots work better in anime and RPG video games, (Final Fantasy 7, for example) and not movies. But this one has it all. Vivid drawings of planets, stars, an extremely well written screenplay. While this is not really for children, they can still watch it, it contains no graphic blood, guts and silicone. But I don't think they're going to understand it.",0,0.890192857068744,"Yeah, it is. In fact, it's somewhere in my top 20 all time favourite movies. Number 15, I think. Anyways, I'm usually not one for plots, but I think plots work better in anime and RPG video games, (Final Fantasy 7, for example) and not movies. But this one has it all. Vivid drawings of planets, stars, an extremely well written screenplay. While this is not really for children, they can still watch it, it contains no graphic blood, guts and silicone. But I don't think they're going to understand it.",Successful
0,387,0,1.23837794463455E-08,"I can barely find the words to express how utterly utterly awful this film is. I was sold on the promise of action, with Segal and stealth aircraft, which normally make for an entertaining action movie. I can honestly say I'd rather gouge my eyes out with a cocktail stick than have to see this film again. The acting was so awful that it was almost funny. The story was insanely weak, with plot holes so cavernously wide you could fly an F117 through them. The script was so poor, if I found out that a 10 year old wrote it I shouldn't be in the least surprised. The direction and production is so amateur, I wouldn't even hire these people to shoot my worst enemies wedding video. Utter Utter drivel. Those responsible for making this movie have cheapened the art, and they should be ashamed of themselves. Steven Segal should never ever show his face in public again, I can't imagine what made him agree to star in this, the worst film I have seen in my entire life.",1,0.63847498315928,"I can barely find the words to express how utterly utterly scary this film is. I was sold on the promise of action, with Segal and stealth aircraft, which normally make for an entertaining action movie. I can honestly say I'd rather gouge my eyes out with a cocktail stick than have to see this film again. The caretaker was so scary that it was almost funny. The story was insanely insecure, with plot holes so cavernously wide you could fly an F117 through them. The script was so poorer, if I found out that a 10 year old wrote it I shouldn't be in the least surprised. The direction and production is so amateur, I wouldn't even hire these people to shoot my greatest enemies wedding video. Utter Utter drivel. Those responsible for making this movie have cheapened the art, and they should be ashamed of themselves. Steven Segal should never ever show his face in public again, I can't imagine what made him agree to star in this, the greatest film I have seen in my entire life.",Successful
0,144,0,0.455796337962356,"In 2004, I liked it. Then it became very stupid. It suggests that kids are brainless. It insults children. Cartoon Network used to be great. One of the shows I liked was Hamtaro. It did manage to be interesting and imaginative in its approach to children programming. The show (Foster's Home for Imaginary Friends) is like putting 20 spoons of sugar in your Sprite. It seems as if today's television producers are only interested in making money, rather than engaging the imaginations of children and making money! Lately, my children are tuning in to the old shows (60's) to find something interesting to watch. Perhaps, in the absence of originality, for television to look to its past and recycle children's programing from days gone by.",1,0.743098528218428,"In 2004, I liked it. Then it became very stupid. It suggests that kids are brainless. It insults children. Cartoon Network used to be great. One of the shows I liked was Hamtaro. It did manage to be interesting and imaginative in its approach to children programming. The show (Foster's Home for Imaginary Friends) is like putting 20 spoons of sugar in your Sprite. It seems as if today's television producers are only interested in making money, rather than engaging the imaginations of children and making moneys! Lately, my children are tuning in to the old shows (60's) to find something interesting to watch. Perhaps, in the absence of originality, for television to look to its past and recycle children's programing from days gone by.",Successful
