ground_truth_output,num_queries,original_output,original_score,original_text,perturbed_output,perturbed_score,perturbed_text,result_type
0,165,0,0.00452944360336,"This dreadful film assembles every Asian stereotype you can imagine into one hideous package. Money grubbing, devious Japanese business men send goofy but loveable policeman Pat Morita to recover industrial secrets in Detroit. Here he encounters a down at heel Jay Leno, who promptly refers to a murder victim as a Jap and calls Morita Tojo. It's all downhill from there.",1,0.613366545326678,"This scary film assembles every Asian prejudices you can imagine into one hideous package. Capital grubbing, devious Japanese business men send goofy but loveable policeman So Morita to recover industrial secrets in Detroit. Here he encounters a down at heel Jay Colbert, who promptly refers to a murder victims as a Jap and calls Morita Tojo. It's all descent from there.",Successful
1,672,1,0.000870063698883,"Please see also my comment on Die Nibelungen part 1: Siegfried.<br /><br />The second part of UFA studio's gargantuan production of the Nibelungen saga continues in the stylised, symphonic and emotionally detached manner of its predecessor. However, whereas part one was a passionless portrayal of individual acts of heroism, part two is a chaotic depiction of bloodletting on a grand scale.<br /><br />As in part one, director Fritz Lang maintains a continuous dynamic rhythm, with the pace of the action and the complexity of the shot composition rising and falling smoothly as the tone of each scene demands. These pictures should only be watched with the note-perfect Gottfried Huppertz score, which fortunately is on the Kino DVD. Now, with this focus on mass action, Lang is presented with greater challenges in staging. The action sequences in his earliest features were often badly constructed, but now he simply makes them part of that rhythmic flow, with the level of activity on the screen swelling up like an orchestra.<br /><br />But just as part one made us witness Siegfried's adventures matter-of-factly and without excitement, part two presents warfare as devastating tragedy. In both pictures, there is a deliberate lack of emotional connection with the characters. That's why Lang mostly keeps the camera outside of the action, never allowing us to feel as if we are there (and this is significant because involving the audience is normally a distinction of Lang's work). That's also why the performances are unnaturally theatrical, with the actors lurching around like constipated sleepwalkers.<br /><br />Nevertheless, Kriemhild's revenge does constantly deal with emotions, and is in fact profoundly humanist. The one moment of naturalism is when Atilla holds his baby son for the first time, and Lang actually emphasises the tenderness of this scene by building up to it with the wild, frantic ride of the huns. The point is that Lang never manipulates us into taking sides, and in that respect this version has more in common with the original saga than the Wagner opera. The climactic slaughter is the very antithesis of a rousing battle scene. Why then did Hitler and co. get so teary-eyed over it, a fact which has unfairly tarnished the reputation of these films? Because the unwavering racial ideology of the Nazis made them automatically view the Nibelungs as the good guys, even if they do kill babies and betray their own kin. For Hitler, their downfall would always be a nationalist tragedy, not a human one.<br /><br />But for us non-nazi viewers, what makes this picture enjoyable is its beautiful sense of pageantry and musical rhythm. When you see these fully-developed silent pictures of Lang's, it makes you realise how much he was wasted in Hollywood. Rather than saddling him with low-budget potboilers, they should have put him to work on a few of those sword-and-sandal epics, pictures that do not have to be believable and do not have to move us emotionally, where it's the poetic, operatic tonality that sweeps us along.",0,0.589778621468226,"Please see also my comment on Die Nibelungen part 1: Siegfried.<br /><br />The second part of UFA studio's gargantuan production of the Nibelungen saga continues in the stylised, symphonic and emotionally detached manner of its predecessor. However, whereas part one was a passionless portrayal of individual acts of heroism, part two is a chaotic depiction of bloodletting on a grand scale.<br /><br />As in part one, director Fritz Lang maintains a continuous dynamic rhythm, with the pace of the action and the complexity of the shot composition rising and falling smoothly as the tone of each scene demands. These pictures should only be watched with the note-perfect Gottfried Huppertz score, which fortunately is on the Kino DVD. Now, with this focus on mass action, Lang is presented with greater challenges in staging. The action footage in his earliest features were often badly constructed, but now he simply makes them part of that rhythmic flow, with the level of activity on the screen swelling up like an orchestra.<br /><br />But just as part one made us witness Siegfried's adventures matter-of-factly and without excitement, part two presents warfare as devastating tragedy. In both pictures, there is a deliberate lack of emotional connection with the characters. That's why Lang mostly hold the camera outside of the action, never allowing us to feel as if we are there (and this is significant because involving the audience is normally a distinction of Lang's work). That's also why the performances are unnaturally theatrical, with the actors lurching around like constipated sleepwalkers.<br /><br />Nevertheless, Kriemhild's revenge does constantly deal with emotions, and is in fact profoundly humanist. The one moment of naturalism is when Atilla holds his baby son for the first time, and Lang actually emphasises the tenderness of this scene by building up to it with the wild, frantic ride of the huns. The point is that Lang never manipulates us into taking sides, and in that respect this version has more in mutual with the original saga than the Wagner opera. The climactic slaughter is the very antithesis of a rousing battle scene. Why then did Hitler and co. get so teary-eyed over it, a fact which has unfairly tarnished the reputation of these films? Because the unwavering racial ideology of the Nazis made them automatically view the Nibelungs as the good guys, even if they do kill babies and betray their own kin. For Hitler, their downfall would always be a nationalist tragedy, not a human one.<br /><br />But for us non-nazi viewers, what paid this picture enjoyable is its beautiful sense of pageantry and musical rhythm. When you see these fully-developed silent pictures of Lang's, it gives you realise how much he was wasted in Hollywood. Rather than saddling him with low-budget potboilers, they should have put him to work on a few of those sword-and-sandal epics, pictures that do not have to be believable and do not have to move us emotionally, where it's the poetic, operatic tonality that sweeps us along.",Successful
0,395,0,1.58671533072585E-05,"Henry Sala's ""Nightmare Weekend"" is a rotten piece of sludge from Troma.This is a juvenile,sloppy and stupid low-budget horror film about some teenage girls spending the weekend at a mansion.The professor's evil assistant lures the girls into a bizarre scheme to perform hideous experiments.Using a brain implant she transforms her victims and their dates into zombies.""Nightmare Weekend"" is a completely braindead piece of garbage that features lots of nudity and some cheesy gore,not to mention a laughable musical score.The acting is horrendous and the script is utterly incoherent.Why such piece of crap is widely distributed is beyond me.Avoid it like the plague.1 out of 10.",1,0.532272300375715,"Henry Sala's ""Nightmare Weekend"" is a rotten piece of sludge from Troma.This is a juvenile,sloppy and jackass low-budget horror film about some teenage girls spending the weekend at a mansion.The professor's evil assistant lures the girls into a intrigued scheme to perform hideous experiments.Using a brain implant she transforms her victims and their dates into zombies.""Nightmare Weekend"" is a completely braindead piece of deny that features lots of nudity and some cheesy valley,not to mention a mindless musical score.The acting is horrendous and the script is utterly incoherent.Why such piece of damn is widely distributed is beyond me.Avoiding it like the plague.1 out of 10.",Successful
1,657,1,7.79915781312646E-06,"Hayao Miyazaki's second feature film, and his first one to be widely acclaimed both commercially and critically (though his debut - Nausicaa AKA Warriors of the Wind is considered by many fans his best), 'Tenku no Shiro Rapyuta' AKA 'Castle in the Sky' may seem childish and simplistic when compared to his more recent masterpieces like 'Kiki's Delivery Service', 'Mononoke-hime' and 'Spirited Away', but in 1986 it was years ahead of its time and it was one of the milestones of modern anime. It's important to remember that 'Castle in the Sky' was made two years before the revolutionary 'Akira', and while it's not provocative and controversial like the aforementioned masterpiece, the lead characters are all mainly basic manga hero / heroine / villain type characters, and the story is quite predictable and obvious (at least in today's standards), Miyazaki's designs and animation work are of standards never seen before. While the story and humor are a bit silly and outdated at times, the movie is still very entertaining and very enjoyable - if not as breathtaking as 'Spirited Away'. And if you'll allow yourself to see the beauty of the frames themselves and ignore the low-budget coloring and animation and the identical twin faces - at this point Miyazaki is still faithful to his roots and to the agreed standards of Japanese cartooning - you'll see Miyazaki's genius shine through as well as it does on 'Spirited Away' and Mononoke. While 'Castle in the Sky', being a sci-fi adventure and very suitable for children, fits in more neatly with classic anime than anything else he had done since, his motifs and principles still show and play an important part. To say much more would be to ruin the movie, so I'll kindly shut up. Suffice to say that I'm giving it only nine stars because if I gave it ten I couldn't go any higher for 'Spirited Away' and 'Princess Mononoke'. And that would be a crime.<br /><br />As in most anime movies, I recommend watching the Japanese version with the English subtitles, even if you don't speak a word of Japanese - the English overdubs just don't tend to be very good, and in this case it's just horrendous. You might want to watch it in the English version once, though, just for the laughs, and for the star-filled cast (the English dub was only recorded following the success of 'Spirited Away', as it was for 'Kiki's Delivery Service') - Anna Paquin and James Van Der Beek (Yeah, the Dawson guy!) fill the lead roles, Mark Hamill (Luke Skywalker from 'Star Wars', in case you don't know!) plays the villain, and other roles are filled by Andy Dick, Tres MacNeille (The Simpsons, Rugrats, Animaniacs...), Michael McShane (Friar Tuck from Kevin Costner's Robin Hood travesty) and Mandy Patinkin (Hello, my name is Inigo Montoya...) Good for a laugh, or a few laughs really. But watch the Japanese one first.",0,0.521543912089826,"Hayao Miyazaki's second feature film, and his first one to be widely acclaimed both commercially and critically (though his debut - Nausicaa AKA Warriors of the Wind is considered by many fans his biggest), 'Tenku no Shiro Rapyuta' AKA 'Castle in the Sky' may seem childish and simplistic when compared to his more recent masterpieces like 'Kiki's Delivery Service', 'Mononoke-hime' and 'Spirited Away', but in 1986 it was years forward of its time and it was one of the milestones of modern anime. It's important to remember that 'Castle in the Sky' was made two years before the revolutionary 'Akira', and while it's not provocative and controversial like the aforementioned masterpiece, the lead characters are all mainly basic manga hero / heroine / villain type characters, and the story is quite predictable and obvious (at least in today's standards), Miyazaki's designs and animation work are of standards never seen before. While the story and humor are a bit silly and outdated at times, the movie is still very entertained and very enjoyable - if not as breathtaking as 'Spirited Away'. And if you'll allow yourself to see the beauty of the frames themselves and ignore the low-budget coloring and animation and the identical twin faces - at this point Miyazaki is still faithful to his roots and to the agreed standards of Japanese cartooning - you'll see Miyazaki's genius bright through as well as it does on 'Spirited Away' and Mononoke. While 'Castle in the Sky', being a sci-fi adventure and very suitable for children, fits in more neatly with regular anime than anything else he had done since, his motifs and principles still show and play an important part. To say much more would be to ruin the movie, so I'll kindly shut up. Suffice to say that I'm giving it only nine stars because if I gave it ten I couldn't go any higher for 'Spirited Away' and 'Princess Mononoke'. And that would be a crime.<br /><br />As in most anime movies, I recommend watching the Japanese version with the English subtitles, even if you don't speak a word of Japanese - the English overdubs just don't tend to be very good, and in this case it's just horrendous. You might want to watch it in the English version once, though, just for the laughs, and for the star-filled cast (the English dub was only recorded following the success of 'Spirited Away', as it was for 'Kiki's Delivery Service') - Anna Paquin and James Van Der Beek (Yeah, the Dawson guy!) fill the lead roles, Mark Hamill (Luke Skywalker from 'Star Wars', in case you don't know!) plays the villain, and other roles are filled by Andy Dick, Tres MacNeille (The Simpsons, Rugrats, Animaniacs...), Michael McShane (Friar Tuck from Kevin Costner's Robin Hood travesty) and Mandy Patinkin (Hello, my name is Inigo Montoya...) Good for a jokes, or a few laughs really. But watch the Japanese one first.",Successful
1,354,1,1.07919179280769E-05,"This is just a great, fun, lovely film. It captures the true essence of the decade and of the people, and tells a beautiful love story of two sisters with two sailors. Though this film may only be in Black and White, it definitely doesn't count against it now in modern days. The main basic purpose of the movie is timeless. This movie features great acting, beautiful song and dance numbers, and great design work and film shots. Follow the Fleet is also comical, there are funny moments, moments that will make you laugh, but other moments where the acting just gets you so involved into the storyline. Its amazing how though this movie may be set in a certain decade, how it can affect those today. If you want to see something great, check this out.",0,0.514916341808868,"This is just a huge, fun, lovely film. It captures the true essence of the decade and of the people, and tells a beautiful love story of two sisters with two sailors. Though this film may only be in Black and White, it definitely doesn't count against it now in modern days. The main basic purpose of the movie is timeless. This movie features huge acting, beautiful song and dance numbers, and huge design work and film shots. Follow the Fleet is also comical, there are funny moments, moments that will make you laugh, but other moments where the acting just gets you so involved into the storyline. Its unbelievable how though this movie may be set in a certain decade, how it can affect those today. If you want to see something huge, check this out.",Successful
0,358,0,9.52939119247542E-06,"This film is terrible. You don't really need to read this review further. If you are planning on watching it, suffice to say - don't (unless you are studying how not to make a good movie).<br /><br />The acting is horrendous... serious amateur hour. Throughout the movie I thought that it was interesting that they found someone who speaks and looks like Michael Madsen, only to find out that it is actually him! A new low even for him!!<br /><br />The plot is terrible. People who claim that it is original or good have probably never seen a decent movie before. Even by the standard of Hollywood action flicks, this is a terrible movie.<br /><br />Don't watch it!!! Go for a jog instead - at least you won't feel like killing yourself.",1,0.653980276044452,"This film is scary. You don't really need to read this explore further. If you are planning on watching it, suffice to say - don't (unless you are studying how not to make a best movie).<br /><br />The acting is horrendous... serious amateur hour. Throughout the movie I thought that it was interesting that they found someone who speaks and waited like Michael Madsen, only to find out that it is actually him! A new low even for him!!<br /><br />The plot is outrageous. People who claim that it is original or good have probably never seen a decent movie before. Even by the standard of Hollywood action flicks, this is a outrageous movie.<br /><br />Don't watch it!!! Go for a jog incidentally - at least you won't feel like killing yourself.",Successful
1,365,1,0.025084719368685,"When people ask me why do I like movies so much, I usually respond, ""have you seen the art-gallery sequence in De Palma's Dressed to Kill?"" That scene alone, pretty much represents everything I want to see in a film. If I was a film director, that would be the kind of thing I'd like to do. ""Pure cinema"" is one way of describing that sequence, and it is truly amazing to see how director De Palma's entire movie works at the same high artistic frequency of that scene. It is a dream-like movie, clever as hell, and with more zest and intelligence than a dozen films put together. I think the movie raises an important point that will always be a topic of heated discussion: could a movie rely solely on technique and still be considered an artistic success? The film has no message to speak of, acting is great but it is at the service of the style, and the script is short on logic. De Palma's movie makes a really good case that style, when handled properly, can sustain a feature length film. Sure, Michael Caine, Angie Dickinson, Nancy Allen and Keith Gordon give superlative performances, but this is a director's movie all the way to the fadeout. It is a sensational demonstration of the possibilities of the film medium. I won't tell you what Hitchcock movie the film pays homage to (I don't want to spoil any surprises), but I think De Palma transcends the story's arc, and he manages to create a film that pretty much summarizes his entire career. Not for the faint of heart!",0,0.794847476592779,"When people ask me why do I like movies so much, I usually respond, ""have you seen the art-gallery sequence in De Palma's Dressed to Kill?"" That scene alone, pretty much represents everything I want to see in a film. If I was a film director, that would be the kind of thing I'd like to do. ""Pure cinema"" is one way of describing that sequence, and it is truly amazing to see how director De Palma's entire movie work at the same high artistic frequency of that scene. It is a dream-like movie, clever as hell, and with more zest and intelligence than a dozen films put together. I think the movie raises an important point that will always be a topic of heated discussion: could a movie rely solely on technique and still be considered an artistic success? The film has no message to speak of, acting is huge but it is at the service of the style, and the script is short on logic. De Palma's movie makes a really good case that style, when handled properly, can sustain a feature length film. Sure, Michael Caine, Angie Dickinson, Nancy Allen and Keith Gordon give superlative performances, but this is a director's movie all the way to the fadeout. It is a sensational demonstration of the possibilities of the film medium. I won't tell you what Hitchcock movie the film pays homage to (I don't want to spoil any surprises), but I think De Palma transcends the story's arc, and he manages to create a film that pretty much summarizes his entire career. Not for the faint of heart!",Successful
0,215,0,7.48022739471832E-06,"I agree totally with the last commenter this could be the worst movie ever made .I too had to fast forward through most of this movie. Michael Madsen must have done this movie as a favor to someone.The picture quality is grainy all the way through .And what little plot there is,is just plain stupid .I give this movie a 1 out of 10 if I could give it a lower score I would .Don't waste your time on this movie or you'll regret it.",1,0.502393026588582,"I agree totally with the last commenter this could be the lamest cinema ever made .I too had to fast ahead through most of this movie. Michael Madsen must have done this movie as a favor to someone.The picture quality is grainy all the way through .And what little plot there is,is just plain mindless .I give this movie a 1 out of 10 if I could give it a lower score I would .Don't losing your timing on this movie or you'll regret it.",Successful
1,254,1,0.002179840171849,"In one of her first movies, Romy Schneider shines as young queen Victoria of Britain, as she is suddenly put into the throne at the age of 18, learns to govern despite the machinations of the politicians, and eventually romances and marries Prince Albert of Saxony. Kitschy and campy (though surprisingly faithful to the real events), this romantic piece is irresistible. Seeing this movie about British royals spoken in German adds to its quaint charm. On that front, one wonders why an Austrian movie was made about an English queen; but then one remembers that in 1954, Austria was still under occupation by allied troops, including British ones. Maybe this was one of the reasons for the existence of this film.",0,0.573295478213619,"In one of her first movies, Romy Schneider shines as young queen Victoria of Britain, as she is suddenly put into the throne at the aged of 18, learns to govern despite the machinations of the politicians, and eventually romances and marries Prince Albert of Saxony. Kitschy and campy (though terribly earnest to the real events), this sloppy piece is irresistible. Seeing this movie about British royals spoken in Bavarian addition to its quaint charm. On that front, one wonders why an Austrian movie was made about an English queen; but then one remembers that in 1954, Austria was still under occupation by allied troops, including British ones. Maybe this was one of the reasons for the existence of this film.",Successful
1,263,1,0.000176633006102,"I found The FBI Story considerably entertaining and suitably upbeat for my New Years Day holiday viewing. Its drama and action-packed episodes were thrilling. The Hardesty character was well drawn and admirable. Overall the photography, script and direction was perfectly creditable. Rather than taking the film to be a repugnant piece of propaganda, as some might, I enjoyed it as a well mounted portrayal of the necessity of ingenious minds and brave bodies in the fight against crime. Again, the depiction of a family holding together even under the strain of the husband's commitment to his (arguably) important work, I did not find to be a twee representation but an ideal and exemplary one.",0,0.575776661915408,"I found The FBI Story considerably entertained and suitably upbeat for my New Older Day holiday viewing. Its dramas and action-packed episodes were thrilling. The Hardesty character was well drawn and admirable. Overall the photography, script and direction was absolutely creditable. Rather than taking the film to be a repugnant piece of propaganda, as some might, I saw it as a well mounted portrayal of the necessity of ingenious minds and brave bodies in the fight against crime. Again, the depiction of a family holding together even under the strain of the husband's commitment to his (arguably) important work, I did not find to be a twee representation but an ideal and exemplary one.",Successful
0,186,0,0.051151735948986,"What an appalling film. Don't get me wrong, Gene Hackman and Denzel Washington are good actors, but aside from a few interesting set pieces, the film is mostly taken up with hysterical submariners shouting, crying, sweating and generally freaking out when anything goes wrong.<br /><br />Take that with simplistic asides to make sure the audience still understand what's going on (the scene where Denzel Washington explains to a radio repairman how he must be like Scotty in Star Trek is nothing more than a joke) and you have a dumbed down thriller not worthy of the acting.<br /><br />Let us just hope that the real nuclear US Navy is not in the hands of such a script!<br /><br />",1,0.557695408435013,"What an appalling film. Don't get me wrong, Gene Hackman and Denzel Washington are good actors, but aside from a few interesting set pieces, the film is mostly taken up with hysterical submariners shouting, crying, sweating and generally freaking out when anything goes wrong.<br /><br />Take that with simplistic asides to make sure the audience still understand what's going on (the scene where Denzel Washington explains to a radio repairman how he must be like Scotty in Star Trek is nothing more than a joke) and you have a dumbed down thriller not worthy of the caretaker.<br /><br />Lets us just hope that the real nuclear US Navy is not in the hands of such a scripts!<br /><br />",Successful
